{
  "version": "0.1",
  "schema": {
    "version": "1.0.0",
    "tables": [
      {
        "name": "organization",
        "directives": { "table": true },
        "fields": [
          {
            "name": "id",
            "type": { "base": "ID", "isList": false },
            "nullable": false,
            "directives": { "pk": true }
          },
          {
            "name": "name",
            "type": { "base": "String", "isList": false },
            "nullable": false,
            "directives": {}
          }
        ],
        "indexes": []
      }
    ]
  },
  "ops": {
    "plans": [
      {
        "root": { "kind": "Table", "table": "organization", "alias": "t0" },
        "projection": { "items": [ { "alias": "id", "expr": { "kind": "ColumnRef", "table": "t0", "column": "id" } } ] }
      }
    ]
  },
  "evidence": {}
}
